Title,Product URL,Image URL,Rating,Number of Reviews,Price
SOFTSPUN Microfiber Cloth - 4 pcs - 40x40 cms - 340 GSM Grey! Thick Lint & Streak-Free Multipurpose Cloths - Automotive Microfibre Towels for Car Bike Cleaning Polishing Washing & Detailing.,https://www.amazon.in/SOFTSPUN-Microfiber-Cleaning-Detailing-Polishing/dp/B077BFH786/ref=zg_bs_g_automotive_d_sccl_1/257-1342139-2055701?psc=1,"https://images-eu.ssl-images-amazon.com/images/I/81dsWgzXLrL._AC_UL600_SR600,400_.jpg",,,₹299.00
Godrej aer O – Hanging Car Air Freshener – Assorted Pack of 3 (22.5g) | Gel Lasts up to 30 days | Car Accessories,https://www.amazon.in/Godrej-aer-Freshener-Assorted-Accessories/dp/B0CXDQWYQP/ref=zg_bs_g_automotive_d_sccl_2/257-1342139-2055701?psc=1,"https://images-eu.ssl-images-amazon.com/images/I/6126Ihs3N4L._AC_UL600_SR600,400_.jpg",,,₹259.00
"ShineXPro Microfiber Car Cleaning Cloth - OG Soft 500 GSM Extra Large (35x75 CM) Microfiber Cloth for Car and Bike - Suede Edging for Scratchless Drying and Detailing (Pack of 2, Grey)",https://www.amazon.in/ShineXPro-Microfiber-Car-Cleaning-Cloth/dp/B09RWTYMCF/ref=zg_bs_g_automotive_d_sccl_3/257-1342139-2055701?psc=1,"https://images-eu.ssl-images-amazon.com/images/I/81hauo1yiwL._AC_UL600_SR600,400_.jpg",,,₹499.00
"Pidilite WD-40, Multipurpose Spray, Rust Remover, Hinge Lubricant, Stain Remover, Degreaser, and Cleaning Agent, 420ml (341g)",https://www.amazon.in/WD-40-Multipurpose-accessories-Lubricant-Degreaser/dp/B07FCHCQCW/ref=zg_bs_g_automotive_d_sccl_4/257-1342139-2055701?psc=1,"https://images-eu.ssl-images-amazon.com/images/I/51iXu11jMdL._AC_UL600_SR600,400_.jpg",,,₹372.00
"Involve Your Senses One Musk Organic Car Perfume, Involve Your Senses Strong Fiber Air Freshener to Freshen'up Your Car - IONE01-40 g,Car Accessories interior car perfumes and fresheners",https://www.amazon.in/Involve-Your-Senses-IONE01-Organic/dp/B00PPY2NB0/ref=zg_bs_g_automotive_d_sccl_5/257-1342139-2055701?psc=1,"https://images-eu.ssl-images-amazon.com/images/I/41n0ALyjZYL._AC_UL600_SR600,400_.jpg",,,₹369.00
"Claiez 5 PCs Microfiber Car Duster with Long Handle Car Cleaning Brush Exteriror and Interiror Car Cleaning Cloth Car Ac Vent Cleaner Brush for Car, Motorbike, SUVs Car Cleaning Kit (A1)",https://www.amazon.in/Microfiber-Car-Exteriror-Interiror-Motorbike/dp/B0D5MB9P2Y/ref=zg_bs_g_automotive_d_sccl_6/257-1342139-2055701?psc=1,"https://images-eu.ssl-images-amazon.com/images/I/71NwL0SI2fL._AC_UL600_SR600,400_.jpg",,,₹499.00
"Boldfit Full Face Helmet Mask Face Mask for Bikers in Riding, Balaclava Full Face Mask Balaclava for Men Black Mask for Bike Riding and Cycling Accessories Mask for Men & Women Full Face Helmet Mask",https://www.amazon.in/Boldfit-Balaclava-Accessories-Cycling-Stylish/dp/B0CKZBDFK4/ref=zg_bs_g_automotive_d_sccl_7/257-1342139-2055701?psc=1,"https://images-eu.ssl-images-amazon.com/images/I/61NL8vUrWUL._AC_UL600_SR600,400_.jpg",,,₹189.00
"FABTEC Waterproof Car Body Cover for Tata Nexon with Mirror and Antenna Pocket, Soft Cotton Lining, Triple Stitched (Heat Resistant Metallic Silver with Black Piping)",https://www.amazon.in/Waterproof-Resistant-Metallic-Compatible-Nexon/dp/B0B2F1TDWW/ref=zg_bs_g_automotive_d_sccl_8/257-1342139-2055701?psc=1,"https://images-eu.ssl-images-amazon.com/images/I/719VjGDQKpL._AC_UL600_SR600,400_.jpg",,,"₹1,399.00"
Autofy Universal Bike Cover UV Protection & Dustproof Bike Body Cover for Two Wheeler Bike Scooter Scooty Activa (Black),https://www.amazon.in/Autofy-Universal-Protection-Dustproof-Wheeler/dp/B0983XZJGX/ref=zg_bs_g_automotive_d_sccl_9/257-1342139-2055701?psc=1,"https://images-eu.ssl-images-amazon.com/images/I/51k9wNfghBS._AC_UL600_SR600,400_.jpg",,,₹248.00
"Steelbird Polyester Full Finger Bike Riding Gloves With Touch Screen Sensitivity At Thumb & Index Finger, Protective Off-Road Motorbike Racing (Medium, Black Grey, Cycling)",https://www.amazon.in/Steelbird-Sensitivity-Protective-Off-Road-Motorbike/dp/B09DYQ7962/ref=zg_bs_g_automotive_d_sccl_10/257-1342139-2055701?psc=1,"https://images-eu.ssl-images-amazon.com/images/I/81EJ4VdwYbL._AC_UL300_SR300,200_.jpg",,,₹599.00
"Premium Car Inflatable Bed with Pump & 2 Air Pillow|Quick Inflatable Back Seat Bed|Car Inflatable Mattress|Car Bed Mattress|Car Bed For Kids,Travel,Trips,Camping,Picnic,Pool & Beach|Universal Fit|Grey",https://www.amazon.in/Premium-Inflatable-Mattress-Camping-Universal/dp/B0C8T31GQZ/ref=zg_bs_g_automotive_d_sccl_11/257-1342139-2055701?psc=1,"https://images-eu.ssl-images-amazon.com/images/I/51gVaFxCw6L._AC_UL300_SR300,200_.jpg",,,"₹1,779.00"
HSR Car Accessories in 10 PCs Car Wiper Detergent Effervescent Tablets Washer Auto Windshield Cleaner Glass Wash Cleaning Tablets,https://www.amazon.in/HSR-Windshield-Cleaning-Cleaner-Effervescent/dp/B07TN7QYB6/ref=zg_bs_g_automotive_d_sccl_12/257-1342139-2055701?psc=1,"https://images-eu.ssl-images-amazon.com/images/I/710ClLSrAWL._AC_UL300_SR300,200_.jpg",,,₹79.00
"Auto Hub 800 GSM Heavy Microfiber Cloth for Car Cleaning and Detailing, Dual Sided, Extra Thick Plush Microfiber Towel Lint-Free, 40cm x 40cm, Pack of 1, Multicolor",https://www.amazon.in/Auto-Hub-Microfiber-Detailing-Cloth/dp/B078PKSS6G/ref=zg_bs_g_automotive_d_sccl_13/257-1342139-2055701?psc=1,"https://images-eu.ssl-images-amazon.com/images/I/61ZNRyWHekL._AC_UL300_SR300,200_.jpg",,,₹189.00
"Pidilite WD-40, Multipurpose Spray, Lubricant, Rust Remover, Cleans Bike Chains, Squeak Noise Remover, Stain Remover, and Cleaning Agent, 170g",https://www.amazon.in/Pidilite-WD-40-Multiple-Maintenance-Spray/dp/B07MDKM7DZ/ref=zg_bs_g_automotive_d_sccl_14/257-1342139-2055701?psc=1,"https://images-eu.ssl-images-amazon.com/images/I/711cF60e5gL._AC_UL300_SR300,200_.jpg",,,₹247.00
3M Car wash Shampoo (1 Litre) | High Foam for Deep Cleaning | Remove Tough Dirt | Safe on Paint | pH Neutral,https://www.amazon.in/3M-IA260166409-care-wash-Shampoo/dp/B00S5SA04U/ref=zg_bs_g_automotive_d_sccl_15/257-1342139-2055701?psc=1,"https://images-eu.ssl-images-amazon.com/images/I/714jMFnhQbL._AC_UL300_SR300,200_.jpg",,,₹760.00
"Porslin 5 Pcs Microfiber Car Duster Kit - Extendable Long Handle Car Cleaning Accessories - Interior & Exterior Detailing Brush Set - Scratch & Lint Free, Perfect for Cars, SUVs, Motorcycles, Home",https://www.amazon.in/Porslin-Pcs-Microfiber-Car-Duster/dp/B0D5D29R1B/ref=zg_bs_g_automotive_d_sccl_16/257-1342139-2055701?psc=1,"https://images-eu.ssl-images-amazon.com/images/I/71XzBXnaOTL._AC_UL300_SR300,200_.jpg",,,₹498.00
Autofy Multipurpose Microfiber 800 GSM Pack of 2-40cm x 40cm Cleaning Towel Microfibre Cloth Highly Absorbent Dust Towels for All Vehicles Bikes Cars Glass Kitchens - Multicolour,https://www.amazon.in/Autofy-Multipurpose-Microfiber-Microfibre-Absorbent/dp/B08V8Y4BVF/ref=zg_bs_g_automotive_d_sccl_17/257-1342139-2055701?psc=1,"https://images-eu.ssl-images-amazon.com/images/I/51ht52q9BVL._AC_UL300_SR300,200_.jpg",,,₹199.00
"Steelbird SBA-7 7Wings ISI Certified Flip-Up Helmet for Men and Women with Inner Smoke Sun Shield Outer Clear Visor ( Large 600 MM, Dashing Black )",https://www.amazon.in/Steelbird-SBA-7-7Wings-Certified-Thermoplastic/dp/B09MKLNBB1/ref=zg_bs_g_automotive_d_sccl_18/257-1342139-2055701?psc=1,"https://images-eu.ssl-images-amazon.com/images/I/61SpcDjsq8L._AC_UL300_SR300,200_.jpg",,,"₹1,516.00"
3M Car Dashboard Dresser (250 ml) | Restores Gloss and Shine on Dashboard and Other Plastic Parts | Protection from UV Rays and Fading,https://www.amazon.in/3M-IA260166359-Auto-Specialty-Dashboard/dp/B00S5SAVQW/ref=zg_bs_g_automotive_d_sccl_19/257-1342139-2055701?psc=1,"https://images-eu.ssl-images-amazon.com/images/I/51-6Y+fNmAL._AC_UL300_SR300,200_.jpg",,,₹333.00
Jopasu Car Duster,https://www.amazon.in/JOPASU-Jopasu-Car-Duster/dp/B00RJQ8XHU/ref=zg_bs_g_automotive_d_sccl_20/257-1342139-2055701?psc=1,"https://images-eu.ssl-images-amazon.com/images/I/61ge72aiPiL._AC_UL300_SR300,200_.jpg",,,₹799.00
3M Foaming Car Interior Cleaner (580 g) | Upholstery and Leather Cleaner | Removes Tough Stains and Dirt Inside Your Car,https://www.amazon.in/3M-Interior-Cleaner-580-g/dp/B0183SZDTS/ref=zg_bs_g_automotive_d_sccl_21/257-1342139-2055701?psc=1,"https://images-eu.ssl-images-amazon.com/images/I/61zxhscfJxL._AC_UL300_SR300,200_.jpg",,,₹700.00
INVOLVE Elements Aqua Spray Air Perfume | Fine Fragrance Car Scent Air Freshener - IELE01-30ml | | Car fresheners | Car accessories interior | Long lasting fregrance | Car perfume,https://www.amazon.in/Involve-Your-Senses-IELE01-Freshener/dp/B00PPY1B18/ref=zg_bs_g_automotive_d_sccl_22/257-1342139-2055701?psc=1,"https://images-eu.ssl-images-amazon.com/images/I/51Fx36mY1UL._AC_UL300_SR300,200_.jpg",,,₹369.00
"XTRIM Protekt - Universal Bike Riding Gloves for Men (Large), Sloping Finger Knuckles, Bike Accessories, Touchscreen Compatible Fingertips, Suede Padding, Gloves for Protection, Washable (Black & Red)",https://www.amazon.in/XTRIM-Protekt-Touchscreen-Compatible-Fingertips/dp/B0C1NZZP5H/ref=zg_bs_g_automotive_d_sccl_23/257-1342139-2055701?psc=1,"https://images-eu.ssl-images-amazon.com/images/I/51qPeNQiiKL._AC_UL300_SR300,200_.jpg",,,₹699.00
"AutokraftZ Black Probiker Protective Full Finger Gloves Anti-Skid Surface Breathable Bike Riding Glove for Motorcycle, Cycling,Climbing Mountaineering,Hiking (Medium, 1 Pair)",https://www.amazon.in/AutokraftZ-Probiker-Racing-Motorcycle-Driving/dp/B07MFLL873/ref=zg_bs_g_automotive_d_sccl_24/257-1342139-2055701?psc=1,"https://images-eu.ssl-images-amazon.com/images/I/61G6QvdPQXL._AC_UL300_SR300,200_.jpg",,,₹253.00
"SHEEBA All in One Multipurpose Liquid Polish for Car, Motorbike, Scooter, Household, Office Care | High Gloss | Easy Application | For Interior & Exterior Surfaces -500mL with Applicator Pad.",https://www.amazon.in/Sheeba-All-One-Multipurpose-Polish/dp/B07QPCKGL4/ref=zg_bs_g_automotive_d_sccl_25/257-1342139-2055701?psc=1,"https://images-eu.ssl-images-amazon.com/images/I/718xrN6x9jL._AC_UL300_SR300,200_.jpg",,,₹232.00
"Frido Ultimate Car Neck Rest Pillow, Ultrasoft Car Pillow for Comfortable Car Rides, Superior Neck Support Cushion, Relieves Neck Pain, Hi-Per Foam Head Rest Pillow with Washable Velvet Cover, Black",https://www.amazon.in/Frido-Ultimate-Ultrasoft-Comfortable-Superior/dp/B0CPYSWJV5/ref=zg_bs_g_automotive_d_sccl_26/257-1342139-2055701?psc=1,"https://images-eu.ssl-images-amazon.com/images/I/716SWYL2IeL._AC_UL300_SR300,200_.jpg",,,"₹1,399.00"
ShineXPro 200mL Windshield Washer Fluid For Car - Car Windshield Cleaner Liquid In Concentrate Form (20mL Enough For 1L Tank) - Get A Streak Free Finish With Our Car Wiper Liquid,https://www.amazon.in/ShineXPro-200mL-Windshield-Washer-Fluid/dp/B09R819BZS/ref=zg_bs_g_automotive_d_sccl_27/257-1342139-2055701?psc=1,"https://images-eu.ssl-images-amazon.com/images/I/51P2qE4J6xL._AC_UL300_SR300,200_.jpg",,,₹251.00
"XTRIM Face Mask for Men & Women, Balaclava for Bike Riding, UV Protected Breathable Helmet Liner, Anti-Hair Fall, Sweat Absorbing & Odour Free 4-Way Stretch, Sun & Dust Protection",https://www.amazon.in/XTRIM-UV-Protected-Breathable-Odour-Free-Protection/dp/B0C1P2QB8K/ref=zg_bs_g_automotive_d_sccl_28/257-1342139-2055701?psc=1,"https://images-eu.ssl-images-amazon.com/images/I/61SvmYo2B-L._AC_UL300_SR300,200_.jpg",,,₹199.00
"RESIL VISTA Black Matte Spray Paint 400 ml (290 g)| DIY Acrylic Spray Paint | Quick-Drying, Multi-Surface Aerosol for Metal, Wood, Plastic, Walls, Automotives",https://www.amazon.in/RESIL-VISTA-Quick-Drying-Multi-Surface-Automotives/dp/B096ZRXJCF/ref=zg_bs_g_automotive_d_sccl_29/257-1342139-2055701?psc=1,"https://images-eu.ssl-images-amazon.com/images/I/61rnIAke3nL._AC_UL300_SR300,200_.jpg",,,₹239.00
Godrej aer O Hanging Car Air Freshener Gel | Car Accessories | Musk After Smoke (7.5G),https://www.amazon.in/Godrej-aer-Hanging-Freshener-Accessories/dp/B0CCY38RGC/ref=zg_bs_g_automotive_d_sccl_30/257-1342139-2055701?psc=1,"https://images-eu.ssl-images-amazon.com/images/I/61oE2-6bt0L._AC_UL300_SR300,200_.jpg",,,₹73.00
"Vega Crux ISI Certified Flip-Up Helmet for Men and Women with Clear Visor(Black, Size:M)",https://www.amazon.in/Certified-Flip-Up-Helmet-Women-Clear/dp/B011GOY6HG/ref=zg_bs_g_automotive_d_sccl_1/257-1342139-2055701?psc=1,"https://images-eu.ssl-images-amazon.com/images/I/51BXMsxaVoL._AC_UL600_SR600,400_.jpg",,,₹748.00
"Vega Crux ISI Certified Flip-Up Helmet for Men and Women with Clear Visor(Black, Size:L)",https://www.amazon.in/Vega-CRX-B-L-Flip-up-Helmet-Black/dp/B010M5MORO/ref=zg_bs_g_automotive_d_sccl_2/257-1342139-2055701?psc=1,"https://images-eu.ssl-images-amazon.com/images/I/61eEetcCb9L._AC_UL600_SR600,400_.jpg",,,"₹1,162.00"
"AGARO Galaxy Cordless Tyre inflator, for Cars & Bikes, Upto 150 PSI, 2X2000 mAh Battery, Powerbank, LED Flash Light, Rechargeable Type C Port, Digital Display, Multiple Nozzles",https://www.amazon.in/AGARO-Cordless-Inflator-Compressor-Rechargeable/dp/B0CGVLDLS8/ref=zg_bs_g_automotive_d_sccl_3/257-1342139-2055701?psc=1,"https://images-eu.ssl-images-amazon.com/images/I/71JPpXEFWAL._AC_UL300_SR300,200_.jpg",,,"₹1,999.00"
"Aerol Silicone Lubricant Spray, Grade 70 (300g/513 ml) Odourless, Colourless & Non-Toxic Lubricant, Rejuvenates & Shines Surfaces, Lubricates Most Plastic, Rubber & Metal Parts",https://www.amazon.in/Lubricant-Odourless-Colourless-Rejuvenates-Lubricates/dp/B01M0OK2LA/ref=zg_bs_g_automotive_d_sccl_4/257-1342139-2055701?psc=1,"https://images-eu.ssl-images-amazon.com/images/I/61U3CNsyZsL._AC_UL300_SR300,200_.jpg",,,₹449.00
Godrej aer Twist Car Air Freshener | Car Accessories | Fresh Lush Green (45g),https://www.amazon.in/Godrej-aer-Twist-Freshener-Fresh/dp/B00NNOE3BW/ref=zg_bs_g_automotive_d_sccl_5/257-1342139-2055701?psc=1,"https://images-eu.ssl-images-amazon.com/images/I/61OeOSrwacL._AC_UL300_SR300,200_.jpg",,,₹376.00
"Wavex Wonder Wash Car Shampoo (1L) | Luxurious Car Wash Shampoo, Honey Thick with Super Suds | Car Washing Shampoo with Peach Fragrance, Produces Thick Foam",https://www.amazon.in/WW1K-Wonder-Shampoo-Golden-Orange/dp/B00XCCPMWO/ref=zg_bs_g_automotive_d_sccl_6/257-1342139-2055701?psc=1,"https://images-eu.ssl-images-amazon.com/images/I/71D2RTZ5BBL._AC_UL300_SR300,200_.jpg",,,₹395.00
SARTE TPU Goggle Mask Anti Scratch UV Protective Open Face & Eyewear Windproof Dirt Shield Adjustable Strap Soft Foam Padded Detachable for Cycling Bike Off Road Racing Riding Unisex (Black),https://www.amazon.in/SARTE-Protective-Windproof-Adjustable-Detachable/dp/B0C72R7Z8P/ref=zg_bs_g_automotive_d_sccl_7/257-1342139-2055701?psc=1,"https://images-eu.ssl-images-amazon.com/images/I/61PdhEIxRwL._AC_UL600_SR600,400_.jpg",,,₹275.00
"SOFTSPUN Microfiber Double Layered Cloth 800 GSM, 30X40 Cms 3 Piece Towel Set Yellow+Grey! Extra Thick Microfiber Cleaning Cloths Perfect for Bike Auto Cars Both Interior and Exterior.",https://www.amazon.in/SOFTSPUN-Microfiber-Cleaning-Interior-Exterior/dp/B08L14327P/ref=zg_bs_g_automotive_d_sccl_8/257-1342139-2055701?psc=1,"https://images-eu.ssl-images-amazon.com/images/I/710BHMzebaL._AC_UL600_SR600,400_.jpg",,,₹329.00
"ELTRON TURBO 3 Months Warranty Original Imported Mini Driving Fog Led Light Dc Power 12V-24V 80W Universal For All Motorcycle, Scooty, Cars, Projector Light White And Yellow (Pack Of 2, Switch)",https://www.amazon.in/Mini-Fog-Light-Universal-Electronic/dp/B09NWBJQ9J/ref=zg_bs_g_automotive_d_sccl_9/257-1342139-2055701?psc=1,"https://images-eu.ssl-images-amazon.com/images/I/41sdvHgEHUL._AC_UL300_SR300,200_.jpg",,,₹976.00
"Vega Edge ISI Certified Full Face Gloss Finish Helmet for Men and Women with Clear Visor(Black, Size:L)",https://www.amazon.in/Vega-Edge-Full-Helmet-Black/dp/B07FCKZ4KM/ref=zg_bs_g_automotive_d_sccl_10/257-1342139-2055701?psc=1,"https://images-eu.ssl-images-amazon.com/images/I/51Gyt4qBauL._AC_UL300_SR300,200_.jpg",,,₹748.00
"Kandid Advance Heavy Duty Digital Number Lock - Universal Combination Cable Lock for Bike, Helmet, Luggage | Steel Wire, PVC, Plastic | 12x1200 mm, Anti-Theft Security",https://www.amazon.in/Kandid-Multipurpose-Number-Bicycle-Helmet/dp/B07Q2BXG1P/ref=zg_bs_g_automotive_d_sccl_11/257-1342139-2055701?psc=1,"https://images-eu.ssl-images-amazon.com/images/I/61z0Kx1ifGL._AC_UL300_SR300,200_.jpg",,,₹199.00
Greenworld Premium Black Metal Car Tyre Valve Cap Air Cap Car Tyre Valve Stem Cap Air Covers with Logo (New-Mahindra),https://www.amazon.in/Greenworld-Premium-Black-Covers-New-Mahindra/dp/B0BZP6JCVS/ref=zg_bs_g_automotive_d_sccl_12/257-1342139-2055701?psc=1,"https://images-eu.ssl-images-amazon.com/images/I/61xbeHp-A+L._AC_UL300_SR300,200_.jpg",,,₹272.00
"Radiant Car Duster, Extendable Long Handle Microfiber Car Duster Exterior Scratch Free Car Cleaning Tool, Car Dust Brush for Truck,SUV, RV, Motorcycle, Vehicles Cleaning",https://www.amazon.in/Extendable-Microfiber-Exterior-Cleaning-Motorcycle/dp/B0DCVYGPNN/ref=zg_bs_g_automotive_d_sccl_13/257-1342139-2055701?psc=1,"https://images-eu.ssl-images-amazon.com/images/I/61br4gtuaOS._AC_UL300_SR300,200_.jpg",,,₹219.00
Tag Holder for car | All Type Cars | Easy to Paste it | No Tape Required| TAG Cover Holder for car,https://www.amazon.in/Holder-Type-Paste-Required-Cover/dp/B0DP9ZSM86/ref=zg_bs_g_automotive_d_sccl_14/257-1342139-2055701?psc=1,"https://images-eu.ssl-images-amazon.com/images/I/51EZn1wM3IL._AC_UL300_SR300,200_.jpg",,,₹189.00
SOFTSPUN Microfiber Cloth 40x40 cms Multi-Color - Thick Lint & Streak-Free Multipurpose Cloths - Automotive Microfibre Towels for Car Bike Cleaning Polishing Washing & Detailing…,https://www.amazon.in/SOFTSPUN-Microfiber-Cleaning-Multi-Color-Absorbent/dp/B081L7PDR2/ref=zg_bs_g_automotive_d_sccl_15/257-1342139-2055701?psc=1,"https://images-eu.ssl-images-amazon.com/images/I/91S2guviqjL._AC_UL300_SR300,200_.jpg",,,₹375.00
"Yourkarts Dead Pool Action Figure PVC Model Movable Joint Set of 3 for Office Desk, Home Décor, Unique Decoration for Car Interiors",https://www.amazon.in/Yourkarts-Action-Movable-Decoration-Interiors/dp/B0DJTH6PTQ/ref=zg_bs_g_automotive_d_sccl_16/257-1342139-2055701?psc=1,"https://images-eu.ssl-images-amazon.com/images/I/311KjfZVIpL._AC_UL300_SR300,200_.jpg",,,₹499.00
"VINSU Car Sticker Carbon Fiber Rubber,Entry Guard Protector Strip Car Door Sill Protector,Bumper Door Guard Scuff Plate Protectors Tape Anti-Scratch Step 5 M Polyvinyl Chloride",https://www.amazon.in/VINSU-Protector-Protectors-Anti-Scratch-Polyvinyl/dp/B0C71JMD27/ref=zg_bs_g_automotive_d_sccl_17/257-1342139-2055701?psc=1,"https://images-eu.ssl-images-amazon.com/images/I/610gcUUmyrS._AC_UL300_SR300,200_.jpg",,,₹359.00
"Steelbird SBH-23 Brutal ISI Certified Open Face Helmet (Dashing Battle Green with Clear Visor, L)",https://www.amazon.in/Steelbird-SBH-23-Brutal-Certified-Dashing/dp/B0CBC6C2H7/ref=zg_bs_g_automotive_d_sccl_18/257-1342139-2055701?psc=1,"https://images-eu.ssl-images-amazon.com/images/I/71s21oNOj9L._AC_UL300_SR300,200_.jpg",,,₹819.00
AutoBizarre Carbon Fibre High Gloss Anti Scratch Black Carbon Fiber Paint Protection Film Tape Ppf For Car Protection And Decoration - 2 Inches X 5 Meters,https://www.amazon.in/AutoBizarre-Scratch-Carbon-Protection-Decoration/dp/B08P71DKH3/ref=zg_bs_g_automotive_d_sccl_19/257-1342139-2055701?psc=1,"https://images-eu.ssl-images-amazon.com/images/I/51UemPi1yjL._AC_UL300_SR300,200_.jpg",,,₹348.00
"3M Premium Liquid Wax, Restores Car Paint Gloss and Lustre, Water Repellent, UV Protection (200ml, Pack of 1)",https://www.amazon.in/3M-IA260166326-Auto-Specialty-Liquid/dp/B00MHQ8JKS/ref=zg_bs_g_automotive_d_sccl_20/257-1342139-2055701?psc=1,"https://images-eu.ssl-images-amazon.com/images/I/71j1MB-GqdL._AC_UL300_SR300,200_.jpg",,,₹336.00
"ShineXPro Microfiber Cloth For Car - Puremagic 1100 Gsm Twisted Loop Super Absorbent Towel - Edgeless Design With Plush Pile, Lint Free Cloth For Drying & Detailing, Transparent",https://www.amazon.in/ShineXPro-Microfiber-Cloth-Car-PureMagic/dp/B09NY7VK6G/ref=zg_bs_g_automotive_d_sccl_21/257-1342139-2055701?psc=1,"https://images-eu.ssl-images-amazon.com/images/I/71tPu1JwI8L._AC_UL300_SR300,200_.jpg",,,₹599.00
SOFTSPUN 900 GSM Microfiber Double Layered Cloth 40x40 Cms 2 Piece Towel Set Extra Thick Microfiber Cleaning Cloths Perfect for Bike Auto Cars Both Interior and Exterior.,https://www.amazon.in/SOFTSPUN-Microfiber-Cleaning-Interior-Exterior/dp/B082GC5NN1/ref=zg_bs_g_automotive_d_sccl_22/257-1342139-2055701?psc=1,"https://images-eu.ssl-images-amazon.com/images/I/81S1cdUdyGL._AC_UL300_SR300,200_.jpg",,,₹344.00
"WILLIBEE 8-in-1 Tubeless Tyre Puncture Repair Kit for Car, Bike, Scooter & SUV - Universal Emergency Tyre Fix Tool Set, Flat Tire Puncher Repair Kit (with Storage Bag).",https://www.amazon.in/WILLIBEE-Universal-Tubeless-Emergency-Motorcycle/dp/B0CLD5SXKX/ref=zg_bs_g_automotive_d_sccl_23/257-1342139-2055701?psc=1,"https://images-eu.ssl-images-amazon.com/images/I/71TFAbURDNL._AC_UL300_SR300,200_.jpg",,,₹325.00
"AllExtreme ‎CYL-06-T Multi-Purpose Bike Chain Cleaner Brush with Soft & Long Bristles Ideal for Quick Cleaning of Cycles, Motorcycles (Blue)",https://www.amazon.in/AllExtreme-%E2%80%8ECYL-06-T-Multi-Purpose-Bristles-Motorcycles/dp/B076DC73XF/ref=zg_bs_g_automotive_d_sccl_24/257-1342139-2055701?psc=1,"https://images-eu.ssl-images-amazon.com/images/I/610XWnl+nXL._AC_UL300_SR300,200_.jpg",,,₹149.00
"RIMPAL FASHION Heavy Duty Metal Electric Car Air Compressor with Pressure Gauge, 12V DC Portable Tyre Inflator Air Pump for Car, Trucks, Bus, Bike, Auto & Van, 150 PSI High Pressure (Horizontal)",https://www.amazon.in/RIMPAL-FASHION-Electric-Compressor-Horizontal/dp/B0DPB7NLD2/ref=zg_bs_g_automotive_d_sccl_25/257-1342139-2055701?psc=1,"https://images-eu.ssl-images-amazon.com/images/I/51kAFdHO3oL._AC_UL300_SR300,200_.jpg",,,₹999.00
Innovqaraj Embossed Aluminium Ind Number Plate for Bike| Fancy | No Bar or Serial Code| for Old Bike Only (White),https://www.amazon.in/Innovqaraj-Embossed-Number-Plate-Serial/dp/B092VYK714/ref=zg_bs_g_automotive_d_sccl_26/257-1342139-2055701?psc=1,"https://images-eu.ssl-images-amazon.com/images/I/91c5wNkIvpL._AC_UL300_SR300,200_.jpg",,,₹399.00
"Auto Hub Microfiber Car Cleaning Cloth - Soft 800 GSM (60x40 cm) Microfiber Cloth for Car and Bike - Scratchless Drying and Detailing 60x40 cm, Pack of 3, Grey",https://www.amazon.in/Auto-Hub-Microfiber-Cleaning-Cloth/dp/B0BCYZ4ZFF/ref=zg_bs_g_automotive_d_sccl_27/257-1342139-2055701?psc=1,"https://images-eu.ssl-images-amazon.com/images/I/61YpfRUjJ4L._AC_UL300_SR300,200_.jpg",,,₹449.00
"SHAYONAM 5 PCS Microfiber Car Duster Kit|Interior & Exterior Car Cleaning Detailing Tool|Scratch & Lint Free, Pollen Removing|Extendable Long Handle Duster for Car, SUV, & Motorcycle/*-",https://www.amazon.in/SHAYONAM-Microfiber-Detailing-Extendable-Motorcycle/dp/B0DM9JC4Z9/ref=zg_bs_g_automotive_d_sccl_28/257-1342139-2055701?psc=1,"https://images-eu.ssl-images-amazon.com/images/I/61NOAx+S2WL._AC_UL300_SR300,200_.jpg",,,₹499.00
"Spotzero by Milton Dust Removal Brush General Cleaning Daily Duster, Flexible Bristles, All Purpose Dusting Brush for Carpet, Keyboard, Home, Hotel and Household - Pack of 1 (Aqua Green)",https://www.amazon.in/Spotzero-Milton-General-Cleaning-Duster/dp/B072J29FFC/ref=zg_bs_g_automotive_d_sccl_29/257-1342139-2055701?psc=1,"https://images-eu.ssl-images-amazon.com/images/I/61GfyzXAMwL._AC_UL300_SR300,200_.jpg",,,₹185.00
"ShineXPro Helmet Cleaner Spray - 125mL - Anti-Bacterial Foaming Helmet Cleaner Spray, Safe For Skin & Hair - Deep Cleans Helmet Interior & Removes Bad Odor",https://www.amazon.in/ShineXPro-Helmet-Cleaner-Spray-Anti-Bacterial/dp/B0D4M7VXDT/ref=zg_bs_g_automotive_d_sccl_30/257-1342139-2055701?psc=1,"https://images-eu.ssl-images-amazon.com/images/I/71YhvFNGl2L._AC_UL300_SR300,200_.jpg",,,₹269.00
