Title,Product URL,Image URL,Rating,Number of Reviews,Price
Shining Diva Fashion 5 Pcs Combo Latest Stylish Infinity Butterfly Pearl Necklace Jewellery Set for Women Pendant Necklace Gifts for Girls (15911np),https://www.amazon.in/Shining-Diva-Fashion-Butterfly-15911np/dp/B0D3DCP7JQ/ref=zg_bs_g_jewelry_d_sccl_1/257-1342139-2055701?psc=1,"https://images-eu.ssl-images-amazon.com/images/I/71R2QnSdv+L._AC_UL600_SR600,400_.jpg",,,₹299.00
"eCraftIndia Christmas Glitter Reindeer Antlers Headband - Deer Horn Hairband for Birthday, Christmas Party",https://www.amazon.in/eCraftIndia-Christmas-Glitter-Reindeer-Headband/dp/B0CN3DFMLJ/ref=zg_bs_g_jewelry_d_sccl_2/257-1342139-2055701?psc=1,"https://images-eu.ssl-images-amazon.com/images/I/91rCOJpHUeL._AC_UL600_SR600,400_.jpg",,,₹219.00
Shining Diva Fashion Latest Stylish Multilayer Gold Plated Bangle Bracelet for Women and Girls (rr14669b) Set of 6,https://www.amazon.in/Shining-Diva-Fashion-Multilayer-rr14669b/dp/B0C1N366XM/ref=zg_bs_g_jewelry_d_sccl_3/257-1342139-2055701?psc=1,"https://images-eu.ssl-images-amazon.com/images/I/71UCk9VMVrL._AC_UL600_SR600,400_.jpg",,,₹268.00
Shining Diva Fashion 26 Pcs Colorful Hair Accessories Hair Clips for Girls Kids Baby Girl Toddlers Women Hairband Hair Band Ties,https://www.amazon.in/Shining-Diva-Fashion-Accessories-14711hb/dp/B0BWJ5MFRY/ref=zg_bs_g_jewelry_d_sccl_4/257-1342139-2055701?psc=1,"https://images-eu.ssl-images-amazon.com/images/I/81WZQlUV40L._AC_UL600_SR600,400_.jpg",,,₹299.00
"Elina Dark Multi Color Elastic Hair Ponytail Holder Soft Non Slip Tight Stretchable Rubber Bands for School Girls/Women, Hair tie (Pack of 30)(Dark English Multicolor)",https://www.amazon.in/Elina-Elastic-Ponytail-Stretchable-Multicolor/dp/B0CT54F8DN/ref=zg_bs_g_jewelry_d_sccl_5/257-1342139-2055701?psc=1,"https://images-eu.ssl-images-amazon.com/images/I/6139MwetDiL._AC_UL600_SR600,400_.jpg",,,₹199.00
"Shining Diva Fashion Latest Stylish Birthday Sash and Crown - Pack of 2 Pcs | Birthday Queen Crown | Birthday Gifts for Best Friend, Sister, Teenager | Birthday Decorations Items",https://www.amazon.in/Shining-Diva-Fashion-Decorations-14860hb/dp/B0C5VKPPZJ/ref=zg_bs_g_jewelry_d_sccl_6/257-1342139-2055701?psc=1,"https://images-eu.ssl-images-amazon.com/images/I/61I3kWwEcLL._AC_UL600_SR600,400_.jpg",,,₹275.00
Shining Diva Fashion 5-7 Pcs Combo Latest Stylish Western Necklace Set for Women Pendant Necklace Gifts for Girls,https://www.amazon.in/Shining-Diva-Fashion-Necklace-15831np/dp/B0D3DDQH3T/ref=zg_bs_g_jewelry_d_sccl_7/257-1342139-2055701?psc=1,"https://images-eu.ssl-images-amazon.com/images/I/61Emq89LIUL._AC_UL600_SR600,400_.jpg",,,₹299.00
Salty Vibrant Blue Winged Butterfly Beauty Pendant Necklace for Women & Girls Neck Chain Locket Fancy Stylish Modern Design Birthday & Special Occassion Gift | Aesthetic Jewellery Everyday Wear,https://www.amazon.in/Salty-Butterfly-Occassion-Aesthetic-Accessories/dp/B0CTK6BJJ9/ref=zg_bs_g_jewelry_d_sccl_8/257-1342139-2055701?psc=1,"https://images-eu.ssl-images-amazon.com/images/I/61C9Fg7N3+L._AC_UL600_SR600,400_.jpg",,,₹429.00
Okos Rose Gold Plated Pink Flowers Link Chain Adjustable Size Charm Alloy Bracelet Decorated With Crystals for Girls & Women BROK1000009,https://www.amazon.in/Okos-Adjustable-Bracelet-Decorated-BROK1000009/dp/B08LKCLRY6/ref=zg_bs_g_jewelry_d_sccl_9/257-1342139-2055701?psc=1,"https://images-eu.ssl-images-amazon.com/images/I/71NbkTQGTML._AC_UL600_SR600,400_.jpg",,,₹91.00
YouBella Jewellery Bracelets for Women Stylish Rose Gold Plated Crystal Bracelet Bangle Jewellery for Girls and Women,https://www.amazon.in/YouBella-Plated-Bracelet-Golden-YBBN_91340A/dp/B071CMQ6N2/ref=zg_bs_g_jewelry_d_sccl_10/257-1342139-2055701?psc=1,"https://images-eu.ssl-images-amazon.com/images/I/71P8z0DrFRL._AC_UL600_SR600,400_.jpg",,,₹183.00
"Shining Diva Fashion Latest Stylish Rose Gold Austrian Crystal Bracelet For Women And Girls (11942B), Free",https://www.amazon.in/Shining-Diva-Fashion-Austrian-11942b/dp/B091MK45DB/ref=zg_bs_g_jewelry_d_sccl_11/257-1342139-2055701?psc=1,"https://images-eu.ssl-images-amazon.com/images/I/51JBNLtPvQS._AC_UL600_SR600,400_.jpg",,,₹299.00
MEENAZ earrings for women fashion jhumka oxidised Silver Earrings for women Combo chandbali pearl chandbali stylish jhumkas traditional Earrings For girls South indian traditional Ear Rings -M124,https://www.amazon.in/MEENAZ-earrings-oxidised-chandbali-traditional/dp/B0CLYCJC2N/ref=zg_bs_g_jewelry_d_sccl_12/257-1342139-2055701?psc=1,"https://images-eu.ssl-images-amazon.com/images/I/910LFbNPhhL._AC_UL600_SR600,400_.jpg",,,₹199.00
YouBella Jewellery Bohemian Multi-Color Earrings for Girls and Women,https://www.amazon.in/YouBella-Precious-Jewellery-Bohemian-Multi-Color/dp/B01MU6O7H7/ref=zg_bs_g_jewelry_d_sccl_13/257-1342139-2055701?psc=1,"https://images-eu.ssl-images-amazon.com/images/I/710dnChlpcS._AC_UL600_SR600,400_.jpg",,,₹183.00
Okos Unisex Fashion Jewellery Adjustable Multi Style Bracelet Sets Made with Beads For Women; Girls ; Boys; Men BR1000050,https://www.amazon.in/Okos-Jewellery-Adjustable-Magnetic-BR1000050COM/dp/B0C4FKPP6N/ref=zg_bs_g_jewelry_d_sccl_14/257-1342139-2055701?psc=1,"https://images-eu.ssl-images-amazon.com/images/I/51bKD0GEChL._AC_UL600_SR600,400_.jpg",,,₹159.00
Shining Diva Fashion 24 pairs Combo Celebrity Inspired Trendy Latest Stylish Gold Plated Geometric Twist Pearl Hoop Dangle Earrings for Women and Girls,https://www.amazon.in/Shining-Diva-Fashion-Earrings-15723er/dp/B0CRB914VD/ref=zg_bs_g_jewelry_d_sccl_15/257-1342139-2055701?psc=1,"https://images-eu.ssl-images-amazon.com/images/I/71rDTCqTo3L._AC_UL600_SR600,400_.jpg",,,₹499.00
Shining Diva Diva Italian Designer Platinum Plated Crystal Butterfly Earrings Chain Pendant Necklace Combo Jewellery Set for Women and Girls (Blue) (14603s),https://www.amazon.in/Valentine-Gift-Shining-Diva-14603s/dp/B0B73SDFWP/ref=zg_bs_g_jewelry_d_sccl_16/257-1342139-2055701?psc=1,"https://images-eu.ssl-images-amazon.com/images/I/51HTyfRbS9L._AC_UL600_SR600,400_.jpg",,,₹474.00
eCraftIndia Merry Christmas Headband Snowflake Design Christmas Hair Band|Hairband for Christmas Party Birthday| Christmas Gift for Children Girls| Christmas Decorations Items for Home Ornaments Props,https://www.amazon.in/eCraftIndia-Christmas-Themed-Headband-Snowflake/dp/B0CN3DT6ZQ/ref=zg_bs_g_jewelry_d_sccl_17/257-1342139-2055701?psc=1,"https://images-eu.ssl-images-amazon.com/images/I/91P2qt0UgDL._AC_UL600_SR600,400_.jpg",,,₹229.00
Shining Diva Fashion Latest Stylish Design Fancy Pearl Bracelet Earrings Necklace Jewellery Set for Women (15214s),https://www.amazon.in/Shining-Diva-Fashion-Jewellery-15214s/dp/B0CV4YFLBR/ref=zg_bs_g_jewelry_d_sccl_18/257-1342139-2055701?psc=1,"https://images-eu.ssl-images-amazon.com/images/I/715x4rLGktL._AC_UL600_SR600,400_.jpg",,,₹499.00
Shining Diva Fashion Bohemian Stackable Multilayer Hamsa Hand Evil Eye Lucky Protection Bracelets Multicolor Crystal Charm Beaded Bracelet for Women Girls,https://www.amazon.in/Shining-Diva-Fashion-Multilayer-14687b/dp/B0C5R9RKL8/ref=zg_bs_g_jewelry_d_sccl_19/257-1342139-2055701?psc=1,"https://images-eu.ssl-images-amazon.com/images/I/61epVg9IzvL._AC_UL300_SR300,200_.jpg",,,₹299.00
Zaveri Pearls Combo of 3 Cubic Zirconia & Pearls Contemporary Stud Earrings For Women-ZPFK10381,https://www.amazon.in/Zaveri-Zirconia-Contemporary-Earrings-Women-ZPFK10381/dp/B0943VVRMN/ref=zg_bs_g_jewelry_d_sccl_20/257-1342139-2055701?psc=1,"https://images-eu.ssl-images-amazon.com/images/I/61Q36kM8geL._AC_UL300_SR300,200_.jpg",,,₹369.00
Yellow Chimes Drop Earrings For Women | Traditional Women Earrings Sets | Ethnic Combo Set Tibetan Laac Drop Earrings For Girls Accessories Jewellery | Birthday Anniversary Gift for Girls Women,https://www.amazon.in/Yellow-Chimes-Traditional-Multi-colour-YCTJER-01LAAC-C-MC/dp/B07PHKD63B/ref=zg_bs_g_jewelry_d_sccl_21/257-1342139-2055701?psc=1,"https://images-eu.ssl-images-amazon.com/images/I/612xyloxhRL._AC_UL300_SR300,200_.jpg",,,₹191.00
"Nilu's Collection Infinity Shape Cubic Zirconia Diamond Bracelet for Women & Girls, Jewelry for Gift, Adjustable Charm Bracelet",https://www.amazon.in/Nilus-Collection-Adjustable-Bracelet-Fashion/dp/B0CJXRVML4/ref=zg_bs_g_jewelry_d_sccl_22/257-1342139-2055701?psc=1,"https://images-eu.ssl-images-amazon.com/images/I/712AZSWOceL._AC_UL300_SR300,200_.jpg",,,₹274.00
"Sanas Hair Extension Clips For Women 4 Pcs Dupatta Clips For Brides (10 Teeth) Dupatta Tic Tac Pin - Safety Pins For Women Saree Pallu & Dupatta Pin For Head - Bridal Dupatta Setting Clip, Safety & Hijab Hair Pins - Chunni Clips - Wig Clip 4 Pcs, Hair Accessories For Women Wedding (Black)",https://www.amazon.in/Sanas-Extension-Clips-Dupatta-Brides/dp/B0DPHYLK6F/ref=zg_bs_g_jewelry_d_sccl_23/257-1342139-2055701?psc=1,"https://images-eu.ssl-images-amazon.com/images/I/71dg1t5TrkL._AC_UL300_SR300,200_.jpg",,,₹199.00
Gold Plated Invisible Transparent Stretchable and Adjustable Lightweighted Elastic Heavy Earrings Support Ear Chains (2 Pair) And Invisible Ear Lobe Support for Earrings Earlobe Tapes and Stickers Earring Supporter for Heavy Earrings Support Patches Girls & Women (Pack 20),https://www.amazon.in/Invisible-Transparent-Stretchable-Adjustable-Lightweighted/dp/B0DK46F5XS/ref=zg_bs_g_jewelry_d_sccl_24/257-1342139-2055701?psc=1,"https://images-eu.ssl-images-amazon.com/images/I/51GQzfLUPBL._AC_UL300_SR300,200_.jpg",,,₹284.00
Brado Jewellery Multi Wearing Heart Necklace 4 Heart Magnetic Rose Gold Necklace Pendant Heart Toggle Necklace Diamond Women/Girls Accessories,https://www.amazon.in/Brado-Jewellery-Necklace-Magnetic-Accessories/dp/B09PYB4XJT/ref=zg_bs_g_jewelry_d_sccl_25/257-1342139-2055701?psc=1,"https://images-eu.ssl-images-amazon.com/images/I/51R3cy1wVmL._AC_UL300_SR300,200_.jpg",,,₹189.00
JEWILLEY Floral Kundan Studded Matha Patti Sheesh Patti Wedding Hairband Traditional Golden Celebrity Headband Hair accessory Jewellery for Women and Girls,https://www.amazon.in/JEWILLEY-Traditional-Celebrity-accessory-Jewellery/dp/B0CZ15Q41X/ref=zg_bs_g_jewelry_d_sccl_26/257-1342139-2055701?psc=1,"https://images-eu.ssl-images-amazon.com/images/I/71z5BHoNwML._AC_UL300_SR300,200_.jpg",,,₹281.00
Shining Diva Valentine Gift Italian Designer Non Precious Metal Jewellery Set for Women (Blue) (Rrsdcmb208),https://www.amazon.in/Valentine-Gift-Shining-Diva-rrsdcmb208/dp/B073MFGJHP/ref=zg_bs_g_jewelry_d_sccl_27/257-1342139-2055701?psc=1,"https://images-eu.ssl-images-amazon.com/images/I/61ZA0394h7L._AC_UL300_SR300,200_.jpg",,,₹399.00
"Wazdorf Girls Hair Pins with Clear Bag, Baby Hair Clips Cute Cute Fruit Cartoon Animal Hair Pin for Kids Hair Clip for Women Girls Hair Accessories (PINK)",https://www.amazon.in/Wazdorf-Girls-Cartoon-Animal-Accessories/dp/B0C5JP8M5P/ref=zg_bs_g_jewelry_d_sccl_28/257-1342139-2055701?psc=1,"https://images-eu.ssl-images-amazon.com/images/I/61wQ69L5ToL._AC_UL300_SR300,200_.jpg",,,₹244.00
Shining Diva Fashion Latest Collection Gold Plated Combo of 2 Bracelet for Women and Girls (Rose Gold) (cmb285_8306b_9556b),https://www.amazon.in/Shining-Diva-Fashion-Collection-cmb285_8306b_9556b/dp/B07DP2ZB5L/ref=zg_bs_g_jewelry_d_sccl_29/257-1342139-2055701?psc=1,"https://images-eu.ssl-images-amazon.com/images/I/71CV1ddvQAL._AC_UL300_SR300,200_.jpg",,,₹299.00
Shining Diva Fashion Latest Sweet Romantic Elegant White Flower Hoop Earrings | Stylish Shell Resin Delicate Pearl Flower Zircon Earrings | Trendy Versatile Jewellery | Light Exquisite Luxury Jewellery,https://www.amazon.in/Shining-Diva-Fashion-Earrings-15066er/dp/B0CNH38J1K/ref=zg_bs_g_jewelry_d_sccl_30/257-1342139-2055701?psc=1,"https://images-eu.ssl-images-amazon.com/images/I/51zqJUDBnWL._AC_UL300_SR300,200_.jpg",,,₹299.00
ZENEME Rhodium-Plated with Silver-Toned White Cubic Zirconia & American Diamond studded Necklace and Drop Earrings Jewellery Set for women,https://www.amazon.in/ZENEME-Rhodium-Plated-Silver-Toned-Zirconia-Jewellery/dp/B0BQJL99KR/ref=zg_bs_g_jewelry_d_sccl_1/257-1342139-2055701?psc=1,"https://images-eu.ssl-images-amazon.com/images/I/71w8bbKVX-L._AC_UL600_SR600,400_.jpg",,,₹678.00
Zeneme Traditional Brass 18 K Gold Plated Wedding Jewellery Bahubali Inspired Long Chain Jhumki Earrings for Women and Girl,https://www.amazon.in/Traditional-Jewellery-Bahubali-Inspired-Earrings/dp/B0B6VQKDGL/ref=zg_bs_g_jewelry_d_sccl_2/257-1342139-2055701?psc=1,"https://images-eu.ssl-images-amazon.com/images/I/61h3itKcGfL._AC_UL600_SR600,400_.jpg",,,₹259.00
Shining Diva Fashion Latest Stylish Traditional Tibetan Pendant Necklace Jewellery Set for Women,https://www.amazon.in/Shining-Diva-Fashion-Traditional-13208s/dp/B0B15GYNS4/ref=zg_bs_g_jewelry_d_sccl_3/257-1342139-2055701?psc=1,"https://images-eu.ssl-images-amazon.com/images/I/617BH0hUF1L._AC_UL300_SR300,200_.jpg",,,₹298.00
Shining Diva Fashion 18K Gold Plated Stainless Steel Openable Crystal Bracelet | Cuff Bangle | Friendship Couple Wedding Gifts for Mother Sister Wife Girlfriend | Anti Tarnish Jewellery,https://www.amazon.in/Shining-Diva-Fashion-Stainless-15747b/dp/B0CN11XNPG/ref=zg_bs_g_jewelry_d_sccl_4/257-1342139-2055701?psc=1,"https://images-eu.ssl-images-amazon.com/images/I/51WkQYLZUsL._AC_UL300_SR300,200_.jpg",,,₹349.00
Shining Diva Fashion Latest Choker Design Antique Kundan Traditional Necklace Jewellery Set for Women,https://www.amazon.in/Shining-Diva-Fashion-Traditional-11279s/dp/B08L13PPNS/ref=zg_bs_g_jewelry_d_sccl_5/257-1342139-2055701?psc=1,"https://images-eu.ssl-images-amazon.com/images/I/81vLw-6u5NL._AC_UL300_SR300,200_.jpg",,,₹325.00
"Seeotwo 2 Pieces Resin Hairband Shark Tooth Style Non-Slip Black Wave Sports Yoga Headband Unisex Fashion Adjustable Wavy Hair Hoop Band for Women, Men, Boys, and Girls",https://www.amazon.in/Seeotwo-Hairband-Non-Slip-Headband-Adjustable/dp/B0D7K4XBY1/ref=zg_bs_g_jewelry_d_sccl_6/257-1342139-2055701?psc=1,"https://images-eu.ssl-images-amazon.com/images/I/413ryiiXUDL._AC_UL300_SR300,200_.jpg",,,₹229.00
Yellow Chimes Bracelets for Girls and Boys | Leather Bracelet for Girls and Boys | Leather Silicon Wristband for Boys | Accessories Jewellery for Unisex | Birthday Gift for Girls and Boys.,https://www.amazon.in/Yellow-Chimes-Stylish-Stainless-Bracelets/dp/B08XXK74F4/ref=zg_bs_g_jewelry_d_sccl_7/257-1342139-2055701?psc=1,"https://images-eu.ssl-images-amazon.com/images/I/616BrEoihYL._AC_UL300_SR300,200_.jpg",,,₹280.00
"YouBella Jewellery Set for Women American Diamond Combo of Choker Necklace Set with Earrings, Bracelet and Ring for Girls and Women",https://www.amazon.in/YouBella-Traditional-Jewellery-American-Mix_Combo_102/dp/B07LH5JMHQ/ref=zg_bs_g_jewelry_d_sccl_8/257-1342139-2055701?psc=1,"https://images-eu.ssl-images-amazon.com/images/I/61hMMT+72SL._AC_UL300_SR300,200_.jpg",,,₹345.00
Shining Diva Fashion 11 Pairs Combo Set Latest Stylish Vintage Pearl Earrings for Women Gold Plated Dangle Earrings Heart Butterfly Hoop Earrings Geometric Fashion Jewelry,https://www.amazon.in/Shining-Diva-Fashion-Earrings-14949er/dp/B0C8T965J4/ref=zg_bs_g_jewelry_d_sccl_9/257-1342139-2055701?psc=1,"https://images-eu.ssl-images-amazon.com/images/I/712FOALLalL._AC_UL300_SR300,200_.jpg",,,₹374.00
YouBella Jewellery Stylish Birthday Sash and Crown - Pack of 2 Pcs | Birthday Girl Crown | Birthday Gifts for Best Friend/Sister (Rose Gold),https://www.amazon.in/YouBella-Jewellery-Stylish-Birthday-Crown/dp/B0CXMZF88F/ref=zg_bs_g_jewelry_d_sccl_10/257-1342139-2055701?psc=1,"https://images-eu.ssl-images-amazon.com/images/I/61P1IkeB9dL._AC_UL300_SR300,200_.jpg",,,₹287.00
MEENAZ Pendant For Girls Women Ladies girlfriend Wife Moti Shell Pearl Necklace locket long chain Rose gold Shell Necklace diamond ad cz Pendants chains western Valentine gifts Birthday lovers -356,https://www.amazon.in/MEENAZ-Pendant-girlfriend-Necklace-357/dp/B0BY5FGBDK/ref=zg_bs_g_jewelry_d_sccl_11/257-1342139-2055701?psc=1,"https://images-eu.ssl-images-amazon.com/images/I/51YU60HM7DL._AC_UL300_SR300,200_.jpg",,,₹249.00
"ARTIFICIAL TREE Handmade Nazariya 6 mm Evil Eye Charms Black Thread Bracelet Adjustable for Women, Men, Girls & Boys 4 Piece (BLACK)(AT GIRLS BRCT 036)",https://www.amazon.in/ARTIFICIAL-TREE-GIRLS-BRCT-036/dp/B0BY3MXKN9/ref=zg_bs_g_jewelry_d_sccl_12/257-1342139-2055701?psc=1,"https://images-eu.ssl-images-amazon.com/images/I/51lblsbg4DL._AC_UL300_SR300,200_.jpg",,,₹170.00
"Atasi International White Stones/AD Diamond Necklace with Earrings - Jewellery Set for Women, Girls Best Suits for Party, Wedding and Festive Occasions",https://www.amazon.in/Atasi-International-Necklace-Jewellery-Earrings/dp/B0B66TGWK6/ref=zg_bs_g_jewelry_d_sccl_13/257-1342139-2055701?psc=1,"https://images-eu.ssl-images-amazon.com/images/I/71WEDh64jhL._AC_UL300_SR300,200_.jpg",,,₹299.00
YouBella Jewellery set for Women Stylish Latest Tibetan Pendant Necklace with Earrings for Women & Girls (Gift) Tribal Necklace Jewellery Beads Necklace,https://www.amazon.in/YouBella-Afghani-Jewellery-Multicolour-MV-FS6S-86K3/dp/B07L9DMG5K/ref=zg_bs_g_jewelry_d_sccl_14/257-1342139-2055701?psc=1,"https://images-eu.ssl-images-amazon.com/images/I/71mjFCuBSDL._AC_UL300_SR300,200_.jpg",,,₹265.00
"eCraftIndia Christmas Santa Claus Headband - Hairband for Birthday, Christmas Party - Gift for kids, Girls (Red, Green, White)",https://www.amazon.in/eCraftIndia-Christmas-Santa-Claus-Headband/dp/B0CN3C2NDZ/ref=zg_bs_g_jewelry_d_sccl_15/257-1342139-2055701?psc=1,"https://images-eu.ssl-images-amazon.com/images/I/91rOgPFrrPL._AC_UL300_SR300,200_.jpg",,,₹159.00
Yellow Chimes Combo Leather Wraps Casual Latest Trend Multi Strand Wrist Bracelets for Men and Women (Unisex),https://www.amazon.in/Yellow-Chimes-Leather-Bracelets-Bracelet/dp/B07VM79W3K/ref=zg_bs_g_jewelry_d_sccl_16/257-1342139-2055701?psc=1,"https://images-eu.ssl-images-amazon.com/images/I/6176bRaGvAL._AC_UL300_SR300,200_.jpg",,,₹199.00
Shining Diva Fashion Stylish Multilayer Chain Pendant Necklace for Women and Girls Minimalist Heart Star Bohemian Crystal Choker Necklace,https://www.amazon.in/Shining-Diva-Fashion-Multilayer-12450np/dp/B08VS48J4W/ref=zg_bs_g_jewelry_d_sccl_17/257-1342139-2055701?psc=1,"https://images-eu.ssl-images-amazon.com/images/I/513iFOMf6XL._AC_UL300_SR300,200_.jpg",,,₹234.00
MEENAZ Brass copper Gold kanchain 3 layer long bridal wedding ear kan chain Champaswaralu earchains Ear Chains for Hair Jhumka Jhumki kanoti moti pearl Traditional Earrings for women girls Golden-M020,https://www.amazon.in/MEENAZ-Champaswaralu-earchains-Traditional-Golden-M020/dp/B09H73ZQBR/ref=zg_bs_g_jewelry_d_sccl_18/257-1342139-2055701?psc=1,"https://images-eu.ssl-images-amazon.com/images/I/71YUwBnGlaL._AC_UL300_SR300,200_.jpg",,,₹205.00
"SILVR BEAR Luxury Satin Scrunchies SAME 6 COLORS AS PIC, Anti-Hair-Breakage, Hair Ties, Scrunchies Set for Girls, Women, Best gift for Sister, Friend, Mom (Classic Skinny)",https://www.amazon.in/Silvr-Bear-Luxury-Skinny-Scrunchies/dp/B09MKM5XJ5/ref=zg_bs_g_jewelry_d_sccl_19/257-1342139-2055701?psc=1,"https://images-eu.ssl-images-amazon.com/images/I/716PxDo1QsL._AC_UL300_SR300,200_.jpg",,,₹299.00
Shining Diva Fashion 18k Rose Gold Stylish Bracelet for Women and Girls,https://www.amazon.in/Shining-Diva-Fashion-Bracelet-Girls/dp/B07NQ1NMWF/ref=zg_bs_g_jewelry_d_sccl_20/257-1342139-2055701?psc=1,"https://images-eu.ssl-images-amazon.com/images/I/51rQL1Fft+L._AC_UL300_SR300,200_.jpg",,,₹320.00
Brado Jewellery Micro Rose Gold Plated White American Diamond Butterfly Shape Necklace Golden Chain Pendant for Women and Girls,https://www.amazon.in/Brado-Jewellery-American-Butterfly-Necklace/dp/B092VBS5FQ/ref=zg_bs_g_jewelry_d_sccl_21/257-1342139-2055701?psc=1,"https://images-eu.ssl-images-amazon.com/images/I/61gxZw2mP4S._AC_UL300_SR300,200_.jpg",,,₹99.00
Shining Diva Fashion 12 Pairs Combo Set Latest Stylish Drop Earrings for Women and Girls (15859er),https://www.amazon.in/Shining-Diva-Fashion-Earrings-15859er/dp/B0D46Y6X5L/ref=zg_bs_g_jewelry_d_sccl_22/257-1342139-2055701?psc=1,"https://images-eu.ssl-images-amazon.com/images/I/61kDSFfrjqL._AC_UL300_SR300,200_.jpg",,,₹299.00
Shining Diva Fashion Latest Stylish Earrings for Women and Girls (14993er),https://www.amazon.in/Shining-Diva-Fashion-Earrings-14993er/dp/B0CNH4XZFR/ref=zg_bs_g_jewelry_d_sccl_23/257-1342139-2055701?psc=1,"https://images-eu.ssl-images-amazon.com/images/I/51Qh9Png4ML._AC_UL300_SR300,200_.jpg",,,₹277.00
Shining Diva Fashion Endless Love Crystal Infinity Bracelet for Women CZ Diamonds Latest Stylish Adjustable Charm Tennis Bracelet for Girls,https://www.amazon.in/Shining-Diva-Fashion-Infinity-10672b/dp/B07RY8K8X9/ref=zg_bs_g_jewelry_d_sccl_24/257-1342139-2055701?psc=1,"https://images-eu.ssl-images-amazon.com/images/I/516vvDWjOEL._AC_UL300_SR300,200_.jpg",,,₹275.00
YouBella Jewellery Earings Gold Plated Floral Earrings for Girls and Women,https://www.amazon.in/YouBella-Plated-Earrings-Off-White-YBEAR_31191/dp/B01N2WJ0OR/ref=zg_bs_g_jewelry_d_sccl_25/257-1342139-2055701?psc=1,"https://images-eu.ssl-images-amazon.com/images/I/71iJUvjnOZL._AC_UL300_SR300,200_.jpg",,,₹190.00
ZULKA Non-Precious Metal with Base Metal and Zircon Gemstone Studded Premium and Traditional Glossy Finished Sleek Bangle set for Women and Girls,https://www.amazon.in/ZULKA-Non-Precious-Gemstone-Finished-Silver_2-8/dp/B0838JPG1V/ref=zg_bs_g_jewelry_d_sccl_26/257-1342139-2055701?psc=1,"https://images-eu.ssl-images-amazon.com/images/I/81bkvYLI7wL._AC_UL300_SR300,200_.jpg",,,₹271.00
"Crystal Heaven Certified Crystal Bracelet for Women Men with Healing Crystal and Reiki Stone - Original Authentic Gemstone Adjustable Beaded Bracelet for Money, Wealth Success & Positive Energy",https://www.amazon.in/Green-Aventurine-Bracelet-Healing-Crystal/dp/B0CQVBDMDD/ref=zg_bs_g_jewelry_d_sccl_27/257-1342139-2055701?psc=1,"https://images-eu.ssl-images-amazon.com/images/I/813wAqHFmVL._AC_UL300_SR300,200_.jpg",,,₹339.00
"XFYT Boho Chic Tie-Dye Workout Hair Bands | Sweat-Proof Your Gym Fitness Soft Wide Head Band Running Yoga Sports Bandana for Girls Women (Mix Boho), Multi-coloured, Microfiber",https://www.amazon.in/Tie-Dye-Workout-Sweat-Proof-Multi-coloured-Microfiber/dp/B0CH6BF15Z/ref=zg_bs_g_jewelry_d_sccl_28/257-1342139-2055701?psc=1,"https://images-eu.ssl-images-amazon.com/images/I/61aPcHeUjkL._AC_UL300_SR300,200_.jpg",,,₹344.00
YouBella Jewellery Sets for Women Enamel Necklace Pendant Jewellery set with Earrings For Girls/Women,https://www.amazon.in/YouBella-Gold-plated-Crystal-Necklace-Earrings/dp/B07D59FYRD/ref=zg_bs_g_jewelry_d_sccl_29/257-1342139-2055701?psc=1,"https://images-eu.ssl-images-amazon.com/images/I/718HwAjw-jL._AC_UL300_SR300,200_.jpg",,,₹391.00
Fashion Frill Delicate Hug Silver Ring For Women I AM Enough Love Adjustable Finger Rings For Women Girls Love Gifts Women's Jewellery Rings Combo,https://www.amazon.in/Fashion-Frill-Stunning-Stainless-American/dp/B0B7F5FCBP/ref=zg_bs_g_jewelry_d_sccl_30/257-1342139-2055701?psc=1,"https://images-eu.ssl-images-amazon.com/images/I/814YFBy43oL._AC_UL300_SR300,200_.jpg",,,₹299.00
