Title,Product URL,Image URL,Rating,Number of Reviews,Price
Boldfit Shoe Bag for Travel & Storage Travel Organizer for Women & Men Travel Accessories Shoe Organizer Shoe Bags Pouches Travel Shoe Cover for Travelling Travel Essentials,https://www.amazon.in/Boldfit-Organizer-Accessories-Travelling-Essentials/dp/B0BK1457X3/ref=zg_bs_g_luggage_d_sccl_1/257-1342139-2055701?psc=1,"https://images-eu.ssl-images-amazon.com/images/I/71UlEDZPiCL._AC_UL600_SR600,400_.jpg",,,₹199.00
Safari Polypropylene (Pp) Pentagon Hardside Small Size Cabin Luggage Suitcase 4 Spinner Wheels Trolley Bags for Travel Black Color 55 Cm,https://www.amazon.in/Safari-Pentagon-Hardside-Luggage-Suitcase/dp/B097L4CKPJ/ref=zg_bs_g_luggage_d_sccl_2/257-1342139-2055701?psc=1,"https://images-eu.ssl-images-amazon.com/images/I/61eORP8Pg-L._AC_UL600_SR600,400_.jpg",,,"₹1,999.00"
Billebon Premium Neck Pillow for Travelling Airplane Travel Pillow Comfortable Head Rest Neck Holder Pillow (Grey),https://www.amazon.in/Billebon-Neck-Pillow-Travelling-Comfortable/dp/B082F88NKP/ref=zg_bs_g_luggage_d_sccl_3/257-1342139-2055701?psc=1,"https://images-eu.ssl-images-amazon.com/images/I/81fBDyL6+KL._AC_UL300_SR300,200_.jpg",,,₹199.00
"WildHorn RFID Protected Leather Wallets for Men I 9 Card Slots I 2 Currency & 2 Secret Compartments I 1 Zipper & 3 Id Card Windows, Green",https://www.amazon.in/WILDHORN%C2%AE-Carter-Leather-Wallet-Oliver/dp/B08P5M592H/ref=zg_bs_g_luggage_d_sccl_4/257-1342139-2055701?psc=1,"https://images-eu.ssl-images-amazon.com/images/I/71mTZSDsK2L._AC_UL300_SR300,200_.jpg",,,₹479.00
"URBAN FOREST Oliver Black Leather Wallet for Men, 6 Card Slot",https://www.amazon.in/Forest-Oliver-Blocking-Leather-Wallet/dp/B07XTJDJHN/ref=zg_bs_g_luggage_d_sccl_5/257-1342139-2055701?psc=1,"https://images-eu.ssl-images-amazon.com/images/I/71jCRAMYlRL._AC_UL300_SR300,200_.jpg",,,₹699.00
"GLUN® Electronic Portable Digital LED Screen Luggage Weighing Scale, 50 kg/110 Lb For Multi-Purpose Use.",https://www.amazon.in/Electronic-Portable-Digital-Luggage-Weighing/dp/B07PK41FL4/ref=zg_bs_g_luggage_d_sccl_6/257-1342139-2055701?psc=1,"https://images-eu.ssl-images-amazon.com/images/I/61Z35SZs7lL._AC_UL300_SR300,200_.jpg",,,₹249.00
"WildHorn Leather Wallet For Men, Brown",https://www.amazon.in/WildHorn-Brown-Wallet-WH2052-Crackle/dp/B07C3VH84K/ref=zg_bs_g_luggage_d_sccl_7/257-1342139-2055701?psc=1,"https://images-eu.ssl-images-amazon.com/images/I/71kq-Lp8MDL._AC_UL300_SR300,200_.jpg",,,₹298.00
"Safari Thorium Neo 8 Wheels 55 Cm Small Cabin Trolley Bag Hard Case Polycarbonate 360 Degree Wheeling System Luggage, Trolley Bags for Travel, Suitcase for Travel, Black",https://www.amazon.in/Safari-Polycarbonate-Wheeling-Speed_Wheel-Suitcase/dp/B097JMLPTC/ref=zg_bs_g_luggage_d_sccl_8/257-1342139-2055701?psc=1,"https://images-eu.ssl-images-amazon.com/images/I/71NPAmyGzgL._AC_UL300_SR300,200_.jpg",,,"₹2,199.00"
"PETRICE Travel Organizer, Packing Cubes for Travel, Travel Essentials, Toiletry Bag, Packing Bags for Clothes, Travel Organizer for Women, Travel Pouch, Packing Cubes Travel Organizer (Grey)",https://www.amazon.in/PETRICE-Organizer-Laundry-Cosmetics-Organizers/dp/B0C692D6CS/ref=zg_bs_g_luggage_d_sccl_9/257-1342139-2055701?psc=1,"https://images-eu.ssl-images-amazon.com/images/I/71z2-hsDBkL._AC_UL300_SR300,200_.jpg",,,₹499.00
Storite PU Leather 9 Slot Vertical Credit Debit Card Holder Money Wallet Zipper Coin Purse for Men Women - Silvergrey (11.5 x 2 x 8 cm),https://www.amazon.in/Storite-Leather-Vertical-Credit-Holder/dp/B098QN3Y5P/ref=zg_bs_g_luggage_d_sccl_10/257-1342139-2055701?psc=1,"https://images-eu.ssl-images-amazon.com/images/I/81hwmX0eDqL._AC_UL300_SR300,200_.jpg",,,₹299.00
"TS WITH TECHSUN Travel Organizer 7 in 1 Travel Laundry Cosmetics Luggage Packing Organizers Set Makeup Bags Organizer Packing Cubes with Shoe Bag for travel, Nylon (Black)",https://www.amazon.in/TS-TECHSUN-Organizer-Organizers-Bag/dp/B0CJ9S6HJ6/ref=zg_bs_g_luggage_d_sccl_11/257-1342139-2055701?psc=1,"https://images-eu.ssl-images-amazon.com/images/I/71LfHvK+PmL._AC_UL300_SR300,200_.jpg",,,₹489.00
"WildHorn Men's Leather Black Wallet, Keychain & Pen Combo Gift Set I Gift for Friend, Boyfriend,Husband,Father, Son",https://www.amazon.in/WildHorn-Leather-Keychain-Boyfriend-Husband/dp/B017IY31X8/ref=zg_bs_g_luggage_d_sccl_12/257-1342139-2055701?psc=1,"https://images-eu.ssl-images-amazon.com/images/I/71BJbk9h0fL._AC_UL300_SR300,200_.jpg",,,₹499.00
"WildHorn Gift Hamper for Men I RFID Protected Leather Wallet, Keychain & Pen Combo Gift Set I Gift for Friend, Boyfriend,Husband,Father, Son etc (Brown M)",https://www.amazon.in/WildHorn-Leather-Keychain-Boyfriend-Husband/dp/B0C3LRF94X/ref=zg_bs_g_luggage_d_sccl_13/257-1342139-2055701?psc=1,"https://images-eu.ssl-images-amazon.com/images/I/61OK6xp3dYL._AC_UL300_SR300,200_.jpg",,,₹599.00
"amazon basics Memory Foam Travel Neck Pillow with Eye Mask and Ear Plugs Combo, Unisex, U-Shaped, Black",https://www.amazon.in/Amazon-Basics-Memory-Travel-U-Shaped/dp/B0C7BM18PB/ref=zg_bs_g_luggage_d_sccl_14/257-1342139-2055701?psc=1,"https://images-eu.ssl-images-amazon.com/images/I/512HeHbIKbL._AC_UL300_SR300,200_.jpg",,,₹329.00
"GoTrippin by Destinio Weight Machine for Luggage - 50 kg capacity, Steel body, Lifetime replacement - Digital Portable Electronic Luggage Weighing Scale for home, travel, flights, bags (Silver, 50 kg)",https://www.amazon.in/GoTrippin-Machine-Luggage-Weighing-Portable/dp/B07Q822CWX/ref=zg_bs_g_luggage_d_sccl_15/257-1342139-2055701?psc=1,"https://images-eu.ssl-images-amazon.com/images/I/71VudJ25xEL._AC_UL300_SR300,200_.jpg",,,₹699.00
"Boldfit Weight Machine For Luggage Weighing Scale, Luggage Weight Machine Weighing Machine For Luggage With LCD Display Luggage Weighing Scale",https://www.amazon.in/Boldfit-Machine-Luggage-Weighing-Capable/dp/B0BJZ5T23Z/ref=zg_bs_g_luggage_d_sccl_16/257-1342139-2055701?psc=1,"https://images-eu.ssl-images-amazon.com/images/I/61en24Ik00L._AC_UL300_SR300,200_.jpg",,,₹499.00
Gear Cross Polyester Training 26L Medium Water Resistant Travel Duffle Bag/Gym Bag/Sports Duffle For Men/Women (Black-Grey),https://www.amazon.in/Gear-Training-Travel-Black-Grey-DUFCRSTNG0104/dp/B098FFTDKT/ref=zg_bs_g_luggage_d_sccl_17/257-1342139-2055701?psc=1,"https://images-eu.ssl-images-amazon.com/images/I/51yLMxZu5wS._AC_UL300_SR300,200_.jpg",,,₹489.00
"Safari Ray 55cm Small Cabin Trolley Bag Hard Case Polycarbonate 4 Wheels 360 Degree Wheeling System Luggage, Travel Bag, Suitcase for Travel, Trolley Bags for Travel, Gun Metal",https://www.amazon.in/Safari-Trolley-Polycarbonate-Wheeling-Suitcase/dp/B0D6WFGFVQ/ref=zg_bs_g_luggage_d_sccl_18/257-1342139-2055701?psc=1,"https://images-eu.ssl-images-amazon.com/images/I/61sgw4gkQwL._AC_UL300_SR300,200_.jpg",,,"₹1,598.00"
Sfane Polyester 23cms Duffle/Shoulder/Gym Bag for Men & Women with Separate Shoe Compartment (Grey),https://www.amazon.in/SFANE-Duffel-Shoulder-Women-Compartment/dp/B07XXFB9CZ/ref=zg_bs_g_luggage_d_sccl_19/257-1342139-2055701?psc=1,"https://images-eu.ssl-images-amazon.com/images/I/71W80G89rwL._AC_UL300_SR300,200_.jpg",,,₹415.00
"Aliston Electronic Portable Fishing Hook Type Digital LED Screen Luggage Weighing Scale, 50 kg/110 Lb (Black)",https://www.amazon.in/Aliston-Portable-Digital-Weighing-Scale/dp/B083C76NYD/ref=zg_bs_g_luggage_d_sccl_20/257-1342139-2055701?psc=1,"https://images-eu.ssl-images-amazon.com/images/I/61UO3xkiNuL._AC_UL300_SR300,200_.jpg",,,₹199.00
American Tourister Liftoff 79 Cms Large Check-in Polypropylene Hard Sided Double Spinner 4 Wheel Luggage/Trolley Bag/Suitcase (Seafoam Blue),https://www.amazon.in/American-Tourister-Liftoff-Polypropylene-Suitcase/dp/B0C4PRZW6W/ref=zg_bs_g_luggage_d_sccl_21/257-1342139-2055701?psc=1,"https://images-eu.ssl-images-amazon.com/images/I/51fIKt4ebgL._AC_UL300_SR300,200_.jpg",,,"₹4,199.00"
Boldfit Waist Bag for Men Fanny Pack for Women Fanny Pack for Men Waist Bag for Women Chest Bag for Women Waist Pouch for Men Waist Bag for Boys Waist Bags for Girls Fanny Bag - Black,https://www.amazon.in/Boldfit-Travel-Accessories-Purse-Mobile/dp/B0BJZQ3ZR9/ref=zg_bs_g_luggage_d_sccl_22/257-1342139-2055701?psc=1,"https://images-eu.ssl-images-amazon.com/images/I/71sXlX7vdyL._AC_UL300_SR300,200_.jpg",,,₹299.00
"Aristocrat Airpro Cabin 55 Cm(Small) Polypropylene 360 Degree 8 Wheels Trolley Bag for Travel Hard Case Luggage, Lightweight with Combination Lock & Robust Trolley with 7 Yrs Warranty (Teal Blue)",https://www.amazon.in/Aristocrat-Airpro-Polypropylene-Hardsided-Trolley/dp/B0BRN1YWYR/ref=zg_bs_g_luggage_d_sccl_23/257-1342139-2055701?psc=1,"https://images-eu.ssl-images-amazon.com/images/I/61TLGY9BGWL._AC_UL300_SR300,200_.jpg",,,"₹1,799.00"
"Skybags Casual Backpack 28L, 2 Main Compartments, Bottle Pocket, Front Pocket, Padded Shoulder Strap",https://www.amazon.in/Skybags-Premium-Polyester-Adjustable-Backpack/dp/B0D1G32M32/ref=zg_bs_g_luggage_d_sccl_24/257-1342139-2055701?psc=1,"https://images-eu.ssl-images-amazon.com/images/I/71KL7So3IgL._AC_UL300_SR300,200_.jpg",,,₹549.00
"Storite 6 Slots RFID Protected Metal Credit Card Holder Wallet for Men & Women(Shiny Black,9.5 x 6.5 x 1.3 cm)",https://www.amazon.in/RiaTech%C2%AE-Stainless-Blocking-Credit-Card/dp/B075F45CGB/ref=zg_bs_g_luggage_d_sccl_25/257-1342139-2055701?psc=1,"https://images-eu.ssl-images-amazon.com/images/I/61aS9nkQnuL._AC_UL300_SR300,200_.jpg",,,₹199.00
"Urban Forest Oliver Redwood Light Brown Leather Wallet for Men, 6 Card Slot",https://www.amazon.in/Forest-Oliver-Blocking-Leather-Wallet/dp/B07XTHKVH9/ref=zg_bs_g_luggage_d_sccl_26/257-1342139-2055701?psc=1,"https://images-eu.ssl-images-amazon.com/images/I/41ehPDL4crL._AC_UL300_SR300,200_.jpg",,,₹699.00
"Rigohill Doger Olive Green Leather Wallet For Men, 2 Card Slot | RFID Wallet",https://www.amazon.in/Rigohill-Doger-Olive-Leather-Wallet/dp/B08Z387RXH/ref=zg_bs_g_luggage_d_sccl_27/257-1342139-2055701?psc=1,"https://images-eu.ssl-images-amazon.com/images/I/71SYvtX2YmL._AC_UL300_SR300,200_.jpg",,,₹449.00
"Safari Astra 8 Wheels 66 Cms Medium Check-In Trolley Bag Hard Case Polycarbonate 360 Degree Wheeling System Luggage, Trolley Bags For Travel, Speed_Wheel Suitcase For Travel, Black",https://www.amazon.in/Safari-Polycarbonate-Wheeling-Speed_Wheel-Suitcase/dp/B097JK9DFN/ref=zg_bs_g_luggage_d_sccl_28/257-1342139-2055701?psc=1,"https://images-eu.ssl-images-amazon.com/images/I/61fPiJCcr-L._AC_UL300_SR300,200_.jpg",,,"₹2,198.00"
"Fur Jaden 55 LTR Rucksack Travel Backpack Bag for Trekking, Hiking with Shoe Compartment",https://www.amazon.in/Rucksack-Travel-Backpack-Trekking-Compartment/dp/B07YDGQQN5/ref=zg_bs_g_luggage_d_sccl_29/257-1342139-2055701?psc=1,"https://images-eu.ssl-images-amazon.com/images/I/71GxZAYa6UL._AC_UL300_SR300,200_.jpg",,,₹899.00
"WildHorn Rfid Protected Leather Wallet For Men, Brown",https://www.amazon.in/Wildhorn-India-Protected-Leather-Wallet/dp/B0B65FSVBV/ref=zg_bs_g_luggage_d_sccl_30/257-1342139-2055701?psc=1,"https://images-eu.ssl-images-amazon.com/images/I/71HoN3mjfWL._AC_UL300_SR300,200_.jpg",,,₹573.00
"Skybags ABS Trooper Medium Size Hardshell Luggage (65 Cm) | Printed Luggage Inline Trolley Bag with 4 Wheels and Resetable Combination Lock | Unisex, Green",https://www.amazon.in/Skybags-Trooper-Luggage-Resetable-Combination/dp/B0C8ZD8KNP/ref=zg_bs_g_luggage_d_sccl_1/257-1342139-2055701?psc=1,"https://images-eu.ssl-images-amazon.com/images/I/61w0Qx4NGbL._AC_UL600_SR600,400_.jpg",,,"₹3,549.00"
"Storite 10 Inch Stylish Padded Mini Sling Bag for Men and Women, Small Passport Travel Bag and Small Sling Bag With Water Bottle Pocket (25x16x7.5cm, Dark Grey)",https://www.amazon.in/Storite-Cross-Travel-Dark-Grey/dp/B07PFF4RYC/ref=zg_bs_g_luggage_d_sccl_2/257-1342139-2055701?psc=1,"https://images-eu.ssl-images-amazon.com/images/I/91Pzq2JtUOL._AC_UL600_SR600,400_.jpg",,,₹315.00
Skybags 68 cms Medium Check-in Polyester Soft Sided 4 Wheels Spinner Luggage/Suitcase/Trolley Bag- Blue,https://www.amazon.in/Skybags-Footloose-Polyester-Softsided-STRUW68EBLU/dp/B073JWDLXZ/ref=zg_bs_g_luggage_d_sccl_3/257-1342139-2055701?psc=1,"https://images-eu.ssl-images-amazon.com/images/I/51njsMj5T+L._AC_UL600_SR600,400_.jpg",,,"₹2,789.00"
"HappyChild Kids School Bag for Boys and Girls, Cute Soft Plush Preschool Animal Cartoon Mini Backpack Little kids bags for 2-5 years",https://www.amazon.in/HappyChild-School-Animal-Cartoon-Travel/dp/B0CSDT6SNF/ref=zg_bs_g_luggage_d_sccl_4/257-1342139-2055701?psc=1,"https://images-eu.ssl-images-amazon.com/images/I/51-6V86u9HL._AC_UL600_SR600,400_.jpg",,,₹229.00
"Niwlix Nylon Travel Organizer For Travel,Travel Essentials,Travel Pouch,Packing Bags For Clothes,Travel Organizer For Women,Packing Bags,Packing Cubes Travel Organizer(Blue),3.8 Cm,21 Cm",https://www.amazon.in/Niwlix-Organizer-Packing-Essentials-Clothes/dp/B0CG9KZHB9/ref=zg_bs_g_luggage_d_sccl_5/257-1342139-2055701?psc=1,"https://images-eu.ssl-images-amazon.com/images/I/61atNNnlmnL._AC_UL600_SR600,400_.jpg",,,₹490.00
NECAVU 100% Cotton Set Of 6 Fridge Drawstring Bag | Eco-Friendly Natural Vegetables Bags For Fridge Storage & Mesh Net Vegetable Bag Fridge | Multi-Purpose Eco-Friendly Cotton Mesh Bag (Neem Green),https://www.amazon.in/Eco-friendly-natural-vegetables-vegetable-Multi-purpose/dp/B09N2MTK8Y/ref=zg_bs_g_luggage_d_sccl_6/257-1342139-2055701?psc=1,"https://images-eu.ssl-images-amazon.com/images/I/A1w9MSOxlfL._AC_UL600_SR600,400_.jpg",,,₹299.00
Tommy Hilfiger Felix Men's Leather Wallet - Brown (4 Card Slot),https://www.amazon.in/Tommy-Hilfiger-Wallet-TH-FELIXGCW03/dp/B07Z9LD5KR/ref=zg_bs_g_luggage_d_sccl_7/257-1342139-2055701?psc=1,"https://images-eu.ssl-images-amazon.com/images/I/71TPFlJ5FjL._AC_UL600_SR600,400_.jpg",,,"₹1,100.00"
"LONDON ALLEY Jason Vintage Brown Leather Wallet, Keyring & Pen Combo Gift Set for Men | Gift Hamper for Men",https://www.amazon.in/LONDON-ALLEY-Vintage-Leather-Keyring/dp/B0C7HHNGHY/ref=zg_bs_g_luggage_d_sccl_8/257-1342139-2055701?psc=1,"https://images-eu.ssl-images-amazon.com/images/I/41tpOq7hJ5L._AC_UL600_SR600,400_.jpg",,,₹549.00
Lavie Sport Sprinter Daypack Unisex Casual Bag For Boys & Girls,https://www.amazon.in/Lavie-Sport-Sprinter-Daypack-Compartment/dp/B0CZNTPV92/ref=zg_bs_g_luggage_d_sccl_9/257-1342139-2055701?psc=1,"https://images-eu.ssl-images-amazon.com/images/I/51lr-4EyyCL._AC_UL600_SR600,400_.jpg",,,₹229.00
"Wooum Polyester Toiletry Bag for Men & Women, Travel Pouch for Toiletries Shaving Kit & Cosmetics, Water Resistance Pouch for Travel Accessories, Organizer Travel Pouch for Make Up, Black",https://www.amazon.in/Durable-Polyester-Toiletry-Shaving-Resistance/dp/B09RY4WHMR/ref=zg_bs_g_luggage_d_sccl_10/257-1342139-2055701?psc=1,"https://images-eu.ssl-images-amazon.com/images/I/71-iIVwlcDL._AC_UL600_SR600,400_.jpg",,,₹260.00
Impulse rucksack bags 60 litres travel bag for men tourist bag for travel backpack for hiking trekking Bag for men camping thames blue bag with 1 Year Warranty,https://www.amazon.in/Impulse-rucksack-60-backpack-trekking/dp/B09TDL9FJ8/ref=zg_bs_g_luggage_d_sccl_11/257-1342139-2055701?psc=1,"https://images-eu.ssl-images-amazon.com/images/I/71gEUGyReJL._AC_UL600_SR600,400_.jpg",,,₹782.00
LONDON ALLEY ELK Vintage Brown Leather Wallet & Black/Brown Reversible Belt Combo Gift Box for Men,https://www.amazon.in/LONDON-ALLEY-Blocking-Vintage-Reversible/dp/B0975499R8/ref=zg_bs_g_luggage_d_sccl_12/257-1342139-2055701?psc=1,"https://images-eu.ssl-images-amazon.com/images/I/51xKbX1FJJL._AC_UL600_SR600,400_.jpg",,,₹999.00
Flyngo 8 Pcs Travel Organizer Pouch Packing Cubes For Clothes Space Savers Bags Cosmetics/Underwear/Socks/Shoes Toiletry Bag Laundry Organiser (Grey) - Nylon,https://www.amazon.in/FLYNGO-Organizer-Cosmetics-Underwear-Organiser/dp/B0CFLJ93VQ/ref=zg_bs_g_luggage_d_sccl_13/257-1342139-2055701?psc=1,"https://images-eu.ssl-images-amazon.com/images/I/515ok3T9eKL._AC_UL600_SR600,400_.jpg",,,₹645.00
Safari Persia 65 Cms Medium Check-in Hardside Polycarbonate 8 Wheels Luggage/Speed_Wheel Suitcase/Trolley Bag (Pearl Blue),https://www.amazon.in/Safari-Hardside-Polycarbonate-Luggage-Suitcase/dp/B097JK7SP2/ref=zg_bs_g_luggage_d_sccl_14/257-1342139-2055701?psc=1,"https://images-eu.ssl-images-amazon.com/images/I/61uDrX7cXvL._AC_UL300_SR300,200_.jpg",,,"₹2,999.00"
Innovative Gifts Men's Personalized Wallet I Customized Slim Stylish Leather Purse with Name & Charm I Unique Birthday Anniversary Gift for Men Boy Love Husband Employees Clients - Olive,https://www.amazon.in/Innovative-Gifts-Wallet-Leather-Premium/dp/B0C5RQKBCY/ref=zg_bs_g_luggage_d_sccl_15/257-1342139-2055701?psc=1,"https://images-eu.ssl-images-amazon.com/images/I/71cetyj3jUL._AC_UL600_SR600,400_.jpg",,,₹499.00
"Storite 9 Slots Leather Credit Debit ATM Card Holder Case Wallet for Men & Women (10.5 x 7 x 2 cm, Brown)",https://www.amazon.in/Storite-Leather-Credit-Holder-Wallet/dp/B0CWGHHYS4/ref=zg_bs_g_luggage_d_sccl_16/257-1342139-2055701?psc=1,"https://images-eu.ssl-images-amazon.com/images/I/81gBGb1JucL._AC_UL300_SR300,200_.jpg",,,₹178.00
American Tourister Ivy 77Cm Large Hardside Polypropylene 4 Wheel Spinner Check-in Suitcase with Recessed TSA Lock & Color-Matched Components for Women & Men - Spring Green,https://www.amazon.in/American-Tourister-Polypropylene-Hardside-Suitcase/dp/B0B3HV8JZK/ref=zg_bs_g_luggage_d_sccl_17/257-1342139-2055701?psc=1,"https://images-eu.ssl-images-amazon.com/images/I/511UgTcm2sL._AC_UL300_SR300,200_.jpg",,,"₹3,799.00"
"London Alley Elk Vintage Brown Leather Wallet For Men, 6 Card Slot | RFID Blocking",https://www.amazon.in/LONDON-ALLEY-Vintage-Blocking-Leather/dp/B08XBCYVY2/ref=zg_bs_g_luggage_d_sccl_18/257-1342139-2055701?psc=1,"https://images-eu.ssl-images-amazon.com/images/I/91nomXcCMvL._AC_UL300_SR300,200_.jpg",,,₹499.00
"Kamiliant American Tourister Harrier 78 Cms Large Check-in Polypropylene (Pp) Hard-Sided 4 Wheels Spinner Luggage/Suitcase/Trolley Bag (Iron Grey), Medium",https://www.amazon.in/American-Tourister-Kamiliant-Harrier-Polypropylene/dp/B0BB2LHY8D/ref=zg_bs_g_luggage_d_sccl_19/257-1342139-2055701?psc=1,"https://images-eu.ssl-images-amazon.com/images/I/61Xc4baWoKL._AC_UL300_SR300,200_.jpg",,,"₹3,099.00"
Safari Small Size 15 Ltrs Unisex Standard Backpack - Sea Blue,https://www.amazon.in/SAFARI-Ltrs-Casual-Backpack-DAYPACKNEO15CBSEB/dp/B07Q7CNPMV/ref=zg_bs_g_luggage_d_sccl_20/257-1342139-2055701?psc=1,"https://images-eu.ssl-images-amazon.com/images/I/61-eiNHjKvL._AC_UL300_SR300,200_.jpg",,,₹207.00
HORNBULL Wallet for Men | Brown Wallet and Belt Gift Hamper for Men | Leather Wallets for Men | Men’s Combo Gift Set,https://www.amazon.in/HORNBULL-Leather-Wallet-Combo-BW4595_Brown/dp/B076FQMZZ1/ref=zg_bs_g_luggage_d_sccl_21/257-1342139-2055701?psc=1,"https://images-eu.ssl-images-amazon.com/images/I/41Mun4ksUXL._AC_UL300_SR300,200_.jpg",,,₹899.00
"Boldfit Shoe Bag for Travel & Storage Travel Organizer for Women & Men Travel Accessories Shoe Organizer Shoe Bags Pouches Travel Shoe Cover, Essentials - Pack of 6 Shoe Pouch (Blue, Yellow, Grey)",https://www.amazon.in/Boldfit-Storage-Organizer-Accessories-Essentials/dp/B0BSR2G3F3/ref=zg_bs_g_luggage_d_sccl_22/257-1342139-2055701?psc=1,"https://images-eu.ssl-images-amazon.com/images/I/81F4YkbCa0L._AC_UL300_SR300,200_.jpg",,,₹199.00
"Lify Shoe Storage Organizer Bags Set, Water-Resistant Nylon Fabric with Sturdy Zipper for Traveling (6 Pack) (Florescent(Neon Green) & Grey)",https://www.amazon.in/Lify-Organizer-Waterproof-Traveling-Florescent/dp/B08LZVJXYQ/ref=zg_bs_g_luggage_d_sccl_23/257-1342139-2055701?psc=1,"https://images-eu.ssl-images-amazon.com/images/I/71ienQAAQkL._AC_UL300_SR300,200_.jpg",,,₹299.00
AICA Personalised Name & Charm Leather Passport Cover Holder for Men & Women (Darkbrown) | Gifts for Men,https://www.amazon.in/AICA-Personalised-Leather-Passport-Darkbrown/dp/B0CK8D3W71/ref=zg_bs_g_luggage_d_sccl_24/257-1342139-2055701?psc=1,"https://images-eu.ssl-images-amazon.com/images/I/71BKoRPN+QL._AC_UL300_SR300,200_.jpg",,,₹299.00
Amazon Basics Travel Bag | 6L Toiletry Organizer Hanging Dopp Kit | Cosmetics Pouch | for Men & Women | Multiple Compartments | Durable | Water-Resistant | (Dark Grey),https://www.amazon.in/Toiletry-Organizer-Cosmetics-Compartments-Water-Resistant/dp/B0CWXX3CJ5/ref=zg_bs_g_luggage_d_sccl_25/257-1342139-2055701?psc=1,"https://images-eu.ssl-images-amazon.com/images/I/81CRf3-1hoL._AC_UL300_SR300,200_.jpg",,,₹329.00
Frantic Kids Velvet School Bag Plush Backpack Baby Girl Preschool Bags Ideal for Baby Boy & Girl Picnic Bags (2-5 Years),https://www.amazon.in/Frantic-Velvet-School-Nursery-Travelling/dp/B091757GK4/ref=zg_bs_g_luggage_d_sccl_26/257-1342139-2055701?psc=1,"https://images-eu.ssl-images-amazon.com/images/I/81srig8NIfL._AC_UL300_SR300,200_.jpg",,,₹229.00
"WildHorn Leather Wallet, Keychain & Pen Combo I Gift Hamper for Men (Brown Crunch)",https://www.amazon.in/WildHorn-Leather-Wallet-Keychain-Hamper/dp/B0D6W16SZK/ref=zg_bs_g_luggage_d_sccl_27/257-1342139-2055701?psc=1,"https://images-eu.ssl-images-amazon.com/images/I/61iQlgkE1aL._AC_UL300_SR300,200_.jpg",,,₹803.00
URBAN FOREST Stag Black/Red Leather Wallet for Men,https://www.amazon.in/Urban-Forest-Blocking-Leather-Wallet/dp/B0B9GPN6RC/ref=zg_bs_g_luggage_d_sccl_28/257-1342139-2055701?psc=1,"https://images-eu.ssl-images-amazon.com/images/I/41S-97Z51tL._AC_UL300_SR300,200_.jpg",,,₹649.00
"Skybags Stroke Cabin Abs Hardshell Luggage (55 Cm) | Printed Luggage 4 Wheel Inline Trolley Bag with 8 Wheels and in-Built Combination Lock | Unisex, Blue and White, Small",https://www.amazon.in/Skybags-Luggage-Printed-Trolley-Combination/dp/B0C8ZY4579/ref=zg_bs_g_luggage_d_sccl_29/257-1342139-2055701?psc=1,"https://images-eu.ssl-images-amazon.com/images/I/71588qy9RLL._AC_UL300_SR300,200_.jpg",,,"₹1,899.00"
Stealodeal Black RFID Blocking Aluminium Pop-Up Debit/Credit/ATM Men/Women Card Holder,https://www.amazon.in/Stealodeal-Aluminium-Blocking-Credit-Holder/dp/B07B3JGHZD/ref=zg_bs_g_luggage_d_sccl_30/257-1342139-2055701?psc=1,"https://images-eu.ssl-images-amazon.com/images/I/51TkG18Sx4L._AC_UL300_SR300,200_.jpg",,,₹136.00
